{
  "schema": "neec-criteria/2.0",
  "framework": "NEEC Applied, v2.0 criteria: 29 criteria in five domains",
  "generated_by": "build_criteria.py version 2.2 (Session 47); do not edit by hand",
  "source": {
    "base": "criteria_s44_snapshot.json",
    "base_md5": "d4b78634cd233adb8c00b1a5e0a00821",
    "record": "NEEC_Criteria_v2_s45.md",
    "record_md5": "640db5a6d57ac65a9de3e050ef8a793e",
    "clause_splits": "SCORING_PROTOCOL_s44_snapshot.md, Appendix B (thresholds v2.0 leaves unchanged)",
    "v1": {
      "document": "NEEC_Paper_v1_4.md",
      "md5": "5e2c2c3e9dc305c95ed7536db95ba1b8",
      "excluded_fields": [
        "Threshold Justification",
        "Current Performance"
      ],
      "removed_comparative_clauses": [
        {
          "criterion": "C1.4",
          "clause": "This is NEEC's single most discriminating criterion (Section 11.2)"
        },
        {
          "criterion": "C2.5",
          "clause": "This is the criterion most often failed by otherwise-strong systems in this corpus (four of the six Potentially/Partially Adequate systems fail it)"
        },
        {
          "criterion": "C4.2",
          "clause": "NEEC's second most discriminating criterion (Section 11.2)"
        }
      ],
      "corrections": [
        {
          "criterion": "C1.2a",
          "field": "anchors.threshold",
          "kind": "wording",
          "basis": "decision D28(g): the anchor's threshold line is the definition's Pass Threshold, verbatim"
        },
        {
          "criterion": "C1.2b",
          "field": "anchors.threshold",
          "kind": "wording",
          "basis": "decision D28(g): the anchor's threshold line is the definition's Pass Threshold, verbatim"
        },
        {
          "criterion": "C1.3",
          "field": "anchors.threshold",
          "kind": "wording",
          "basis": "decision D28(g): the anchor's threshold line is the definition's Pass Threshold, verbatim"
        },
        {
          "criterion": "C1.4",
          "field": "anchors.threshold",
          "kind": "wording",
          "basis": "decision D28(g): the anchor's threshold line is the definition's Pass Threshold, verbatim"
        },
        {
          "criterion": "C1.5",
          "field": "anchors.note",
          "kind": "moved",
          "basis": "decision D28(g): band reasoning formerly appended to the threshold line"
        },
        {
          "criterion": "C1.5",
          "field": "anchors.threshold",
          "kind": "wording",
          "basis": "decision D28(g): the anchor's threshold line is the definition's Pass Threshold, verbatim"
        },
        {
          "criterion": "C2.1",
          "field": "anchors.threshold",
          "kind": "substantive",
          "basis": "decision D28(g): the anchor's threshold line is the definition's Pass Threshold, verbatim",
          "departure": "dropped the revealed-preference elaboration (noted by the R4 audit, outside its four)"
        },
        {
          "criterion": "C2.2",
          "field": "anchors.threshold",
          "kind": "substantive",
          "basis": "decision D28(g): the anchor's threshold line is the definition's Pass Threshold, verbatim",
          "departure": "dropped the population clause 'for all residents' and the list of basic needs, and added the Measurement line's conditions (found in Session 36)"
        },
        {
          "criterion": "C2.3",
          "field": "anchors.threshold",
          "kind": "wording",
          "basis": "decision D28(g): the anchor's threshold line is the definition's Pass Threshold, verbatim"
        },
        {
          "criterion": "C2.4",
          "field": "anchors.threshold",
          "kind": "wording",
          "basis": "decision D28(g): the anchor's threshold line is the definition's Pass Threshold, verbatim"
        },
        {
          "criterion": "C2.5",
          "field": "anchors.threshold",
          "kind": "substantive",
          "basis": "decision D28(g): the anchor's threshold line is the definition's Pass Threshold, verbatim",
          "departure": "dropped 'voluntary association protected' (R4 audit)"
        },
        {
          "criterion": "C3.1",
          "field": "anchors.threshold",
          "kind": "substantive",
          "basis": "decision D28(g): the anchor's threshold line is the definition's Pass Threshold, verbatim",
          "departure": "added 'no legislative delay' from the Measurement line and dropped the 1:1 example (R4 audit)"
        },
        {
          "criterion": "C3.2",
          "field": "anchors.threshold",
          "kind": "wording",
          "basis": "decision D28(g): the anchor's threshold line is the definition's Pass Threshold, verbatim"
        },
        {
          "criterion": "C3.3",
          "field": "anchors.threshold",
          "kind": "wording",
          "basis": "decision D28(g): the anchor's threshold line is the definition's Pass Threshold, verbatim"
        },
        {
          "criterion": "C3.4",
          "field": "anchors.threshold",
          "kind": "wording",
          "basis": "decision D28(g): the anchor's threshold line is the definition's Pass Threshold, verbatim"
        },
        {
          "criterion": "C3.5",
          "field": "anchors.threshold",
          "kind": "wording",
          "basis": "decision D28(g): the anchor's threshold line is the definition's Pass Threshold, verbatim"
        },
        {
          "criterion": "C4.1",
          "field": "anchors.threshold",
          "kind": "wording",
          "basis": "decision D28(g): the anchor's threshold line is the definition's Pass Threshold, verbatim"
        },
        {
          "criterion": "C4.2",
          "field": "anchors.threshold",
          "kind": "wording",
          "basis": "decision D28(g): the anchor's threshold line is the definition's Pass Threshold, verbatim"
        },
        {
          "criterion": "C4.3",
          "field": "anchors.threshold",
          "kind": "wording",
          "basis": "decision D28(g): the anchor's threshold line is the definition's Pass Threshold, verbatim"
        },
        {
          "criterion": "C4.4",
          "field": "anchors.threshold",
          "kind": "wording",
          "basis": "decision D28(g): the anchor's threshold line is the definition's Pass Threshold, verbatim"
        },
        {
          "criterion": "C4.5",
          "field": "anchors.threshold",
          "kind": "wording",
          "basis": "decision D28(g): the anchor's threshold line is the definition's Pass Threshold, verbatim"
        },
        {
          "criterion": "C5.1",
          "field": "anchors.threshold",
          "kind": "substantive",
          "basis": "decision D28(g): the anchor's threshold line is the definition's Pass Threshold, verbatim",
          "departure": "dropped 'matching claimed benefits' (R4 audit)"
        },
        {
          "criterion": "C5.2",
          "field": "anchors.threshold",
          "kind": "wording",
          "basis": "decision D28(g): the anchor's threshold line is the definition's Pass Threshold, verbatim"
        },
        {
          "criterion": "C5.3",
          "field": "anchors.threshold",
          "kind": "substantive",
          "basis": "decision D28(g): the anchor's threshold line is the definition's Pass Threshold, verbatim",
          "departure": "dropped 'through modeling' and 'coordination protocols established' (R4 audit)"
        },
        {
          "criterion": "C5.4",
          "field": "anchors.threshold",
          "kind": "wording",
          "basis": "decision D28(g): the anchor's threshold line is the definition's Pass Threshold, verbatim"
        },
        {
          "criterion": "C5.5",
          "field": "anchors.threshold",
          "kind": "wording",
          "basis": "decision D28(g): the anchor's threshold line is the definition's Pass Threshold, verbatim"
        },
        {
          "criterion": "C3.2",
          "field": "anchors.bands.0.0",
          "kind": "band",
          "basis": "decision D26 (revision R3); Correction 7's stale count removed from this anchor"
        },
        {
          "criterion": "C3.2",
          "field": "anchors.bands.0.5",
          "kind": "band",
          "basis": "decision D26 (revision R3); Correction 7's stale count removed from this anchor"
        }
      ]
    }
  },
  "scale": {
    "values": [
      0.0,
      0.5,
      1.0
    ],
    "labels": {
      "1.0": "Pass",
      "0.5": "Partial / Conditional",
      "0.0": "Full Failure"
    },
    "rule": "Reason continuously, then round once, at the criterion level (Appendix H.3)."
  },
  "structure": {
    "criteria": 29,
    "total_max": 29.0,
    "domain_max": {
      "D1": 6.0,
      "D2": 6.0,
      "D3": 6.0,
      "D4": 6.0,
      "D5": 5.0
    },
    "tiers_note": "Tier bands stay integer failure counts (0-2, 3-5, 6+) on 29 criteria (decision 45.1); Paper v2.0 Appendix A.4 reports the proportional alternative."
  },
  "tiers": [
    {
      "name": "Potentially Adequate",
      "failures_min": 0,
      "failures_max": 2
    },
    {
      "name": "Partially Adequate",
      "failures_min": 3,
      "failures_max": 5
    },
    {
      "name": "Structurally Inadequate",
      "failures_min": 6,
      "failures_max": 29
    }
  ],
  "domains": [
    {
      "id": "D1",
      "name": "Material Security",
      "core_question": "Can the system provide material necessities reliably and universally?",
      "criteria": [
        "C1.1",
        "C1.2a",
        "C1.2b",
        "C1.3",
        "C1.4",
        "C1.5"
      ]
    },
    {
      "id": "D2",
      "name": "Human Autonomy",
      "core_question": "Does the system maximize human freedom and self-determination?",
      "criteria": [
        "C2.1",
        "C2.2",
        "C2.3",
        "C2.4",
        "C2.5",
        "C2.6"
      ]
    },
    {
      "id": "D3",
      "name": "System Resilience",